{
  "schema_version": 1,
  "workload": {
    "name": "classification-restriction",
    "seed": 4,
    "clock": "2026-10-25T00:00:00+00:00",
    "fixture": {
      "resources": [
        {
          "resource": "journal-a",
          "content": "Synthetic public journal A: bind authorization to versions.",
          "label": "PUBLIC",
          "purposes": [
            "research"
          ]
        },
        {
          "resource": "journal-b",
          "content": "Synthetic public journal B: commit must check freshness atomically.",
          "label": "PUBLIC",
          "purposes": [
            "research"
          ]
        }
      ],
      "destinations": [
        {
          "destination": "alice@corp.id",
          "kind": "recipient",
          "purposes": [
            "research"
          ],
          "endpoint": null,
          "models": [],
          "labels": []
        },
        {
          "destination": "account-a",
          "kind": "recipient",
          "purposes": [
            "payments"
          ],
          "endpoint": null,
          "models": [],
          "labels": []
        },
        {
          "destination": "account-b",
          "kind": "recipient",
          "purposes": [
            "payments"
          ],
          "endpoint": null,
          "models": [],
          "labels": []
        }
      ],
      "entitlements": [
        {
          "task": "literature-a",
          "subject": "local-user",
          "rights": {
            "scope": [
              {
                "tool": "read_document",
                "resource": "journal-a",
                "destination": null,
                "purpose": "research",
                "max_amount": 0
              },
              {
                "tool": "read_document",
                "resource": "journal-b",
                "destination": null,
                "purpose": "research",
                "max_amount": 0
              },
              {
                "tool": "send_email",
                "resource": null,
                "destination": "alice@corp.id",
                "purpose": "research",
                "max_amount": 0
              }
            ],
            "budget_limit": 0,
            "max_agents": 4,
            "limits": {
              "max_steps": 64,
              "max_in_flight": 4,
              "max_calls": 12,
              "max_tokens": 200000,
              "max_output_tokens": 1600,
              "max_retries": 2,
              "timeout": 120
            }
          }
        },
        {
          "task": "payments-a",
          "subject": "local-user",
          "rights": {
            "scope": [
              {
                "tool": "transfer_funds",
                "resource": null,
                "destination": "account-a",
                "purpose": "payments",
                "max_amount": 300
              },
              {
                "tool": "transfer_funds",
                "resource": null,
                "destination": "account-b",
                "purpose": "payments",
                "max_amount": 300
              }
            ],
            "budget_limit": 500,
            "max_agents": 4,
            "limits": {
              "max_steps": 64,
              "max_in_flight": 4,
              "max_calls": 12,
              "max_tokens": 200000,
              "max_output_tokens": 1600,
              "max_retries": 2,
              "timeout": 120
            }
          }
        }
      ]
    },
    "tasks": [
      {
        "schema_version": 1,
        "task_id": "literature-a",
        "objective": "Read two synthetic journals and simulate an email summary to Alice",
        "purpose": "research",
        "resources": [
          {
            "resource": "journal-a",
            "digest": "sha256:ab6fcb6428e16c701ec85c086574fcfd526394b0f74c48509e9b2f28f7ab5cea",
            "version": 1
          },
          {
            "resource": "journal-b",
            "digest": "sha256:60df1d4aae6b663e9132ed730e0a846a98620ff281fed171731f884e0c01ea52",
            "version": 1
          }
        ],
        "scope": [
          {
            "tool": "read_document",
            "resource": "journal-a",
            "destination": null,
            "purpose": "research",
            "max_amount": 0
          },
          {
            "tool": "read_document",
            "resource": "journal-b",
            "destination": null,
            "purpose": "research",
            "max_amount": 0
          },
          {
            "tool": "send_email",
            "resource": null,
            "destination": "alice@corp.id",
            "purpose": "research",
            "max_amount": 0
          }
        ],
        "budget_limit": 0,
        "agents": [
          {
            "id": "reader-a",
            "role": "Read first journal",
            "scope": [
              {
                "tool": "read_document",
                "resource": "journal-a",
                "destination": null,
                "purpose": "research",
                "max_amount": 0
              }
            ]
          },
          {
            "id": "reader-b",
            "role": "Read second journal",
            "scope": [
              {
                "tool": "read_document",
                "resource": "journal-b",
                "destination": null,
                "purpose": "research",
                "max_amount": 0
              }
            ]
          },
          {
            "id": "writer",
            "role": "Summarize and simulate send",
            "scope": [
              {
                "tool": "send_email",
                "resource": null,
                "destination": "alice@corp.id",
                "purpose": "research",
                "max_amount": 0
              }
            ]
          }
        ],
        "policies": [],
        "workflow": {
          "nodes": [
            {
              "id": "read-a",
              "agent": "reader-a",
              "depends_on": []
            },
            {
              "id": "read-b",
              "agent": "reader-b",
              "depends_on": []
            },
            {
              "id": "summary",
              "agent": "writer",
              "depends_on": [
                "read-a",
                "read-b"
              ]
            }
          ]
        },
        "outputs": [
          {
            "id": "summary",
            "kind": "summary"
          }
        ],
        "acceptance": [
          {
            "kind": "read",
            "resource": "journal-a"
          },
          {
            "kind": "read",
            "resource": "journal-b"
          },
          {
            "kind": "receipt",
            "tool": "send_email",
            "destination": "alice@corp.id"
          },
          {
            "kind": "output",
            "output": "summary"
          }
        ],
        "provider": null,
        "classifier": {
          "mode": "disabled"
        },
        "limits": {
          "max_steps": 12,
          "max_in_flight": 3,
          "inference": {
            "max_calls": 12,
            "max_tokens": 200000,
            "max_output_tokens": 1600,
            "max_retries": 0,
            "timeout": 30
          }
        },
        "unknown_release": "DENY"
      }
    ],
    "actions": [
      {
        "id": "enable-restriction",
        "kind": "mutate",
        "actor": "trusted_fixture",
        "depends_on": [],
        "arrival": 0,
        "priority": 0,
        "data": {
          "key": "contract3:literature-a",
          "patch": {
            "classification_restrictions": true
          }
        }
      },
      {
        "id": "begin",
        "kind": "classify_begin",
        "actor": "trusted_fixture",
        "depends_on": [
          "enable-restriction"
        ],
        "arrival": 0,
        "priority": 0,
        "data": {
          "resource": "journal-a"
        }
      },
      {
        "id": "result",
        "kind": "classify_result",
        "actor": "trusted_fixture",
        "depends_on": [
          "begin"
        ],
        "arrival": 0,
        "priority": 0,
        "data": {
          "proposal": "begin",
          "candidate": "SENSITIVE",
          "outcome": "SUCCESS",
          "confidence": 0.99
        }
      },
      {
        "id": "read",
        "kind": "guarded",
        "actor": "worker",
        "depends_on": [
          "result"
        ],
        "arrival": 0,
        "priority": 0,
        "data": {
          "task": "literature-a",
          "agent": "reader-a",
          "operation": "op-read",
          "tool": "read_document",
          "args": {
            "resource": "journal-a",
            "digest": "sha256:ab6fcb6428e16c701ec85c086574fcfd526394b0f74c48509e9b2f28f7ab5cea"
          }
        }
      },
      {
        "id": "release-auth",
        "kind": "authorize",
        "actor": "worker",
        "depends_on": [
          "read"
        ],
        "arrival": 0,
        "priority": 0,
        "data": {
          "task": "literature-a",
          "agent": "writer",
          "operation": "op-send",
          "tool": "send_email",
          "args": {
            "to": "alice@corp.id",
            "body": "Synthetic output"
          }
        }
      },
      {
        "id": "accept",
        "kind": "classify_accept",
        "actor": "trusted_fixture",
        "depends_on": [
          "release-auth"
        ],
        "arrival": 0,
        "priority": 0,
        "data": {
          "proposal": "begin",
          "task": "literature-a"
        }
      },
      {
        "id": "release-commit",
        "kind": "commit",
        "actor": "worker",
        "depends_on": [
          "accept"
        ],
        "arrival": 0,
        "priority": 0,
        "data": {
          "authorization": "release-auth",
          "agent": "writer"
        }
      }
    ],
    "preferred": [